Position,Const,Created,Modified,Description,Name,Known For,Birth Date
1,nm0000138,2016-12-11,2020-01-13,"Once Upon a Time in Hollywood, What's Eating Gilbert Grape, The Aviator, Blood Diamond, The Wolf of Wall Street, The Revenant",Leonardo DiCaprio,Inception,1974-11-11
2,nm0186505,2016-12-11,2016-12-11,Trumbo,Bryan Cranston,Breaking Bad,1956-03-07
3,nm0000354,2016-12-11,2016-12-11,"Good Will Hunting, Invictus, The Martian",Matt Damon,Good Will Hunting,1970-10-08
4,nm1055413,2016-12-11,2016-12-11,"12 Years a Slave, Steve Jobs",Michael Fassbender,Shame,1977-04-02
5,nm1519666,2016-12-11,2016-12-11,"The Theory of Everything, The Danish Girl",Eddie Redmayne,Les Misérables,1982-01-06
6,nm0488953,2016-12-11,2016-12-11,Room,Brie Larson,Room,1989-10-01
7,nm0000949,2016-12-11,2016-12-11,"Elizabeth, The Aviator, Notes on a Scandal, Elizabeth: The Golden Age, I'm Not there, Blue Jasmine, Carol",Cate Blanchett,Carol,1969-05-14
8,nm2225369,2016-12-11,2016-12-11,"Winter's Bone, Silver Linings Playbook, American Hustle, Joy",Jennifer Lawrence,The Hunger Games,1990-08-15
9,nm0001648,2016-12-11,2016-12-11,45 Years,Charlotte Rampling,Swimming Pool,1946-02-05
10,nm1519680,2016-12-11,2020-01-13,"Little Women, Lady Bird, Atonement, Brooklyn",Saoirse Ronan,Hanna,1994-04-12
11,nm0753314,2016-12-11,2016-12-11,Bridge of Spies,Mark Rylance,Bridge of Spies,1960-01-18
12,nm0000288,2016-12-11,2019-01-22,"Vice, The Fighter, American Hustle, The Big Short",Christian Bale,The Dark Knight,1974-01-30
13,nm0362766,2016-12-11,2016-12-11,The Revenant,Tom Hardy,Inception,1977-09-15
14,nm0749263,2016-12-11,2016-12-11,"The Kids Are All Right, Foxcatcher, Spotlight",Mark Ruffalo,Spotlight,1967-11-22
15,nm0000230,2016-12-11,2016-12-11,"Rocky, Creed",Sylvester Stallone,Rocky,1946-07-06
16,nm2539953,2016-12-11,2016-12-11,The Danish Girl,Alicia Vikander,Ex Machina,1988-10-03
17,nm0000492,2016-12-11,2016-12-11,The Hateful Eight,Jennifer Jason Leigh,The Hateful Eight,1962-02-05
18,nm1913734,2016-12-11,2016-12-11,"The Girl with the Dragon Tattoo, Carol",Rooney Mara,Carol,1985-04-17
19,nm1046097,2016-12-11,2016-12-11,Spotlight,Rachel McAdams,The Notebook,1978-11-17
20,nm0000701,2016-12-11,2016-12-11,"Sense and Sensibility, Titanic, Iris, Eternal Sunshine of the Spotless Mind, Little Children, The Reader, Steve Jobs",Kate Winslet,Titanic,1975-10-05
21,nm0136797,2016-12-11,2016-12-11,Foxcatcher,Steve Carell,The Office,1962-08-16
22,nm0177896,2016-12-11,2019-01-22,"A Star is Born, American Sniper, American Hustle, Silver Linings Playbook",Bradley Cooper,A Star Is Born,1975-01-05
23,nm1212722,2016-12-11,2022-02-10,"The Power of the Dog, The Imitation Game",Benedict Cumberbatch,Star Trek Into Darkness,1976-07-19
24,nm0000474,2016-12-11,2016-12-11,Birdman or (The Unexpected Virtue of Ignorance),Michael Keaton,Birdman or (The Unexpected Virtue of Ignorance),1951-09-05
25,nm0000194,2016-12-11,2016-12-11,"Boogie Nights, The End of the Affair, Far From Heaven, The Hours, Still Alice",Julianne Moore,Far from Heaven,1960-12-03
26,nm0182839,2016-12-11,2016-12-11,"Le Vie en Rose, Two Days One Night",Marion Cotillard,La Môme,1975-09-30
27,nm0428065,2016-12-11,2016-12-11,The Theory of Everything,Felicity Jones,Rogue One,1983-10-17
28,nm0683253,2016-12-11,2016-12-11,Gone Girl,Rosamund Pike,Gone Girl,
29,nm0000702,2016-12-11,2016-12-11,"Walk the Line, Wild",Reese Witherspoon,Wild,1976-03-22
30,nm0799777,2016-12-11,2022-02-10,"Being the Ricardos, Whiplash",J.K. Simmons,Whiplash,1955-01-09
31,nm0000380,2016-12-11,2016-12-11,"The Judge, A Civil Action, The Apostle, Tender Mercies, The Great Santini, Apocalypse Now, The Godfather",Robert Duvall,The Apostle,1931-01-05
32,nm0000160,2016-12-11,2016-12-11,"Training Day, Boyhood",Ethan Hawke,Training Day,1970-11-06
33,nm0001570,2016-12-11,2016-12-11,"Primal Fear, American History X, Birdman or (The Unexpected Virtue of Ignorance)",Edward Norton,Fight Club,1969-08-18
34,nm0000099,2016-12-11,2016-12-11,Boyhood,Patricia Arquette,True Romance,1968-04-08
35,nm0000368,2016-12-11,2020-01-13,"Marriage Story, Rambling Rose, Wild",Laura Dern,Jurassic Park,1967-02-10
36,nm0461136,2016-12-11,2016-12-11,"Pride and Prejudice, The Imitation Game",Keira Knightley,Pirates of the Caribbean: The Curse of the Black Pearl,1985-03-26
37,nm1297015,2016-12-11,2019-01-22,"The Favourite, Birdman or (The Unexpected Virtue of Ignorance), La La Land",Emma Stone,La La Land,1988-11-06
38,nm0000658,2016-12-11,2018-01-23,"The Post, Into the Woods, August: Osage County, The Iron Lady, Julie and Julia, Doubt, The Devil Wears Prada, Adaptation, Music of the Heart, One True Thing, The Bridges of Madison County, Postcards From the Edge, A Cry in the Dark, Ironweed, Out of Africa, Silkwood, Sophie's Choice, The French Lieutenant's Woman, Kramer vs. Kramer, The Deer Hunter, Florence Foster Jenkins",Meryl Streep,Out of Africa,1949-06-22
39,nm0000190,2016-12-11,2016-12-11,The Dallas Buyers Club,Matthew McConaughey,Dallas Buyers Club,1969-11-04
40,nm0001136,2016-12-11,2016-12-11,"Coming Home, Nebraska",Bruce Dern,Nebraska,1936-06-04
41,nm0252230,2016-12-11,2016-12-11,12 Years a Slave,Chiwetel Ejiofor,12 Years a Slave,1977-07-10
42,nm0001467,2016-12-11,2016-12-11,The Dallas Buyers Club,Jared Leto,Dallas Buyers Club,1971-12-26
43,nm5831542,2016-12-11,2016-12-11,Captain Phillips,Barkhad Abdi,Captain Phillips,1985-04-10
44,nm1706767,2016-12-11,2016-12-11,"The Wolf of Wall Street, Moneyball",Jonah Hill,21 Jump Street,1983-12-20
45,nm0010736,2016-12-11,2019-01-22,"Vice, Junebug, Doubt, The Fighter, The Master, American Hustle",Amy Adams,Arrival,1974-08-20
46,nm0000113,2016-12-11,2016-12-11,"The Blind Side, Gravity",Sandra Bullock,The Proposal,1964-07-26
47,nm0001132,2016-12-11,2022-02-10,"Belfast, Philomena, Notes on a Scandal, Mrs. Henderson Presents, Iris, Chocolat, Shakespeare in Love, Mrs. Brown",Judi Dench,Skyfall,1934-12-09
48,nm2143282,2016-12-11,2016-12-11,12 Years a Slave,Lupita Nyong'o,12 Years a Slave,1983-03-01
49,nm1020089,2016-12-11,2018-01-23,"The Shape of Water, Blue Jasmine",Sally Hawkins,The Shape of Water,1976-04-27
50,nm0000210,2016-12-11,2016-12-11,"August: Osage County, Erin Brokovich, Pretty Woman, Steel Magnolias",Julia Roberts,Pretty Woman,1967-10-28
51,nm0820053,2016-12-11,2016-12-11,Nebraska,June Squibb,Nebraska,1929-11-06
52,nm0000358,2016-12-11,2018-01-23,"Phantom Thread, Lincoln, There Will Be Blood, Gangs of New York, In the Name of the Father, My Left Foot",Daniel Day-Lewis,There Will Be Blood,1957-04-29
53,nm0413168,2016-12-11,2016-12-11,Les Miserables,Hugh Jackman,Les Misérables,1968-10-12
54,nm0001618,2016-12-11,2020-01-13,"Joker, The Master, Walk the Line, Gladiator",Joaquin Phoenix,Her,1974-10-28
55,nm0000243,2016-12-11,2022-02-10,"The Tragedy of Macbeth, Roman J. Israel Esq., Fences, Flight, Training Day, The Hurricane, Malcolm X, Glory, Cry Freedom",Denzel Washington,Fences,1954-12-28
56,nm1567113,2016-12-11,2022-02-10,"The Eyes of Tammy Faye, Zero Dark Thirty, The Help",Jessica Chastain,Zero Dark Thirty,1977-03-24
57,nm0728938,2016-12-11,2016-12-11,Amour,Emmanuelle Riva,Hiroshima mon amour,1927-02-24
58,nm4832920,2016-12-11,2016-12-11,Beasts of the Southern Wild,Quvenzhané Wallis,Beasts of the Southern Wild,2003-08-28
59,nm0915208,2016-12-11,2016-12-11,"21 Grams, The Impossible",Naomi Watts,Mulholland Dr.,1968-09-28
60,nm0004266,2016-12-11,2016-12-11,"Les Miserables, Rachel Getting Married",Anne Hathaway,Les Misérables,1982-11-12
61,nm0000398,2016-12-11,2016-12-11,"Lincoln, Places in the Heart, Norma Rae",Sally Field,Forrest Gump,1946-11-06
62,nm0000166,2016-12-11,2016-12-11,"The Sessions, As Good As It Gets",Helen Hunt,As Good as It Gets,1963-06-15
63,nm0915865,2016-12-11,2016-12-11,"Silver Linings Playbook, Animal Kindom",Jacki Weaver,Silver Linings Playbook,1947-05-25
64,nm0000273,2016-12-11,2016-12-11,"Argo, Little Miss Sunshine, The Heart is a Lonely Hunter, The Russians Are Coming The Russians Are Coming",Alan Arkin,Argo,1934-03-26
65,nm0910607,2016-12-11,2016-12-11,"Django Unchained, Inglourious Basterds",Christoph Waltz,Django Unchained,1956-10-04
66,nm0000134,2016-12-11,2016-12-11,"Silver Linings Playbook, Cape Fear, Awakenings, Raging Bull, The Deer Hunter, Taxi Driver, The Godfather Part II",Robert De Niro,Raging Bull,1943-08-17
67,nm0000450,2016-12-11,2016-12-11,"The Master, Doubt, Charlie Wilson's War, Capote",Philip Seymour Hoffman,The Master,1967-07-23
68,nm0000169,2016-12-11,2016-12-11,"Lincoln, In the Valley of Elah, The Fugitive, JFK",Tommy Lee Jones,The Fugitive,1946-09-15
69,nm0241121,2016-12-11,2016-12-11,The Artist,Jean Dujardin,The Artist,1972-06-19
70,nm0065007,2016-12-11,2016-12-11,A Better Life,Demián Bichir,The Hateful Eight,1963-08-01
71,nm0000123,2016-12-11,2016-12-11,"The Descendants, Up in the Air, Michael Clayton, Syriana",George Clooney,The Ides of March,1961-05-06
72,nm0000198,2016-12-11,2021-03-17,"Mank, Darkest Hour, Tinker Tailor Soldier Spy",Gary Oldman,The Dark Knight,1958-03-21
73,nm0000093,2016-12-11,2020-01-13,"Once Upon a Time in Hollywood, Moneyball, The Curious Case of Benjamin Button, 12 Monkeys",Brad Pitt,Ad Astra,1963-12-18
74,nm0001626,2016-12-11,2018-01-23,"All the Money in the World, Beginners, The Last Station",Christopher Plummer,Beginners,1929-12-13
75,nm0000335,2016-12-11,2021-03-17,"Hillbilly Elegy, The Wife, Albert Nobbs, Dangerous Liaisons, Fatal Attraction, The Natural, The Big Chill, The World According to Garp",Glenn Close,Fatal Attraction,1947-03-19
76,nm0205626,2016-12-11,2021-03-17,"Ma Rainey's Black Bottom, Fences, Doubt, The Help",Viola Davis,Fences,1965-08-11
77,nm0931329,2016-12-11,2017-01-24,"Manchester by the Sea, My Week with Marilyn, Blue Valentine, Brokeback Mountain",Michelle Williams,My Week with Marilyn,1980-09-09
78,nm0818055,2016-12-11,2018-01-23,"The Shape of Water, Hidden Figures, The Help",Octavia Spencer,Hidden Figures,1970-05-25
79,nm0067367,2016-12-11,2016-12-11,The Artist,Bérénice Bejo,The Artist,1976-07-07
80,nm0565250,2016-12-11,2019-01-22,"Can You Ever Forgive Me?, Bridesmaids",Melissa McCarthy,The Heat,1970-08-26
81,nm0005216,2016-12-11,2016-12-11,"Albert Nobbs, Tumbleweeds",Janet McTeer,Albert Nobbs,1961-08-05
82,nm0000110,2016-12-11,2016-12-11,"My Week with Marilyn, Henry V",Kenneth Branagh,Henry V,1960-12-10
83,nm0000560,2016-12-11,2016-12-11,"Warrior, Affliction, The Prince of Tides",Nick Nolte,Warrior,1941-02-08
84,nm0001884,2016-12-11,2016-12-11,"Extremely Loud and Incredibly Close, Pelle the Conqueror",Max von Sydow,Flash Gordon,1929-04-10
85,nm0000147,2016-12-11,2016-12-11,"The King's Speech, A Single Man",Colin Firth,A Single Man,1960-09-10
86,nm0000849,2016-12-11,2022-02-10,"Being the Ricardos, Biutiful, No Country for Old Men, Before Night Falls",Javier Bardem,Skyfall,1969-03-01
87,nm0000313,2016-12-11,2017-01-24,"Hell or High Water, True Grit, Crazy Heart, The Contender, Starman, Thunderbolt and Lightfoot, The Last Picture Show",Jeff Bridges,The Big Lebowski,1949-12-04
88,nm0251986,2016-12-11,2016-12-11,The Social Network,Jesse Eisenberg,The Social Network,1983-10-05
89,nm0290556,2016-12-11,2016-12-11,127 Hours,James Franco,Spring Breakers,1978-04-19
90,nm0000204,2016-12-11,2017-01-24,"Jackie, Black Swan, Closer",Natalie Portman,Black Swan,1981-06-09
91,nm0000906,2016-12-11,2016-12-11,"The Kids Are All Right, Being Julia, American Beauty, The Grifters",Annette Bening,American Beauty,1958-05-29
92,nm0000173,2016-12-11,2022-02-10,"Being the Ricardos, Lion, Rabbit Hole, The Hours, Moulin Rouge!",Nicole Kidman,Moulin Rouge!,1967-06-20
93,nm0370035,2016-12-11,2016-12-11,Winter's Bone,John Hawkes,The Sessions,1959-09-11
94,nm0719637,2016-12-11,2016-12-11,"The Town, The Hurt Locker",Jeremy Renner,The Hurt Locker,1971-01-07
95,nm0001691,2016-12-11,2016-12-11,"The King's Speech, Quills, Shakespeare in Love, Shine",Geoffrey Rush,The King's Speech,1951-07-06
96,nm0502425,2016-12-11,2016-12-11,"The Fighter, Frozen River",Melissa Leo,The Fighter,1960-09-14
97,nm0000307,2016-12-11,2016-12-11,"The King's Speech, The Wings of the Dove",Helena Bonham Carter,Sweeney Todd: The Demon Barber of Fleet Street,1966-05-26
98,nm2794962,2016-12-11,2016-12-11,True Grit,Hailee Steinfeld,True Grit,1996-12-11
99,nm0000151,2016-12-11,2016-12-11,"Invictus, Million Dollar Baby, The Shawshank Redemption, Driving Miss Daisy, Street Smart",Morgan Freeman,Invictus,1937-06-01
100,nm0000545,2016-12-11,2016-12-11,"The Last Station, The Queen, Gosford Park, The Madness of King George",Helen Mirren,The Queen,1945-07-26
101,nm1659547,2016-12-11,2021-03-17,"Promising Young Woman, An Education",Carey Mulligan,Never Let Me Go,1985-05-28
102,nm2829737,2016-12-11,2016-12-11,Precious,Gabourey Sidibe,Precious,1983-05-06
103,nm0000437,2016-12-11,2018-01-23,"Three Billboards Outside Ebbing Missouri, The Messenger, The People vs. Larry Flynt",Woody Harrelson,True Detective,1961-07-23
104,nm0001804,2016-12-11,2016-12-11,The Lovely Bones,Stanley Tucci,Big Night,1960-11-11
105,nm0594898,2016-12-11,2016-12-11,Precious,Mo'Nique,Precious,1967-12-11
106,nm0004851,2016-12-11,2022-02-10,"Parallel Mothers, Nine, Vicky Christina Barcelona, Volver",Penélope Cruz,Vicky Cristina Barcelona,1974-04-28
107,nm0267812,2016-12-11,2016-12-11,Up in the Air,Vera Farmiga,Up in the Air,1973-08-06
108,nm0350454,2016-12-11,2016-12-11,Crazy Heart,Maggie Gyllenhaal,Secretary,1977-11-16
109,nm0447695,2016-12-11,2016-12-11,Up in the Air,Anna Kendrick,Up in the Air,1985-08-09
110,nm0000576,2016-12-11,2016-12-11,"Milk, Mystic River, I Am Sam, Sweet and Lowdown, Dead Man Walking",Sean Penn,Mystic River,1960-08-17
111,nm0420955,2016-12-11,2018-01-23,"The Shape of Water, The Visitor",Richard Jenkins,The Shape of Water,1947-05-04
112,nm0001449,2016-12-11,2016-12-11,Frost/Nixon,Frank Langella,Frost/Nixon,1938-01-01
113,nm0000620,2016-12-11,2016-12-11,The Wrestler,Mickey Rourke,Sin City,1952-09-16
114,nm0001401,2016-12-11,2016-12-11,"Changeling, Girl Interrupted",Angelina Jolie,"Girl, Interrupted",1975-06-04
115,nm0005132,2016-12-11,2016-12-11,"The Dark Knight, Brokeback Mountain",Heath Ledger,Brokeback Mountain,1979-04-04
116,nm0000982,2016-12-11,2016-12-11,Milk,Josh Brolin,Avengers: Endgame,1968-02-12
117,nm0788335,2016-12-11,2017-01-24,"Nocturnal Animals, Revolutionary Road",Michael Shannon,Take Shelter,1974-08-07
118,nm0378245,2016-12-11,2016-12-11,The Curious Case of Benjamin Button,Taraji P. Henson,The Curious Case of Benjamin Button,1970-09-11
119,nm0000673,2016-12-11,2016-12-11,"The Wrestler, In the Bedroom, My Cousin Vinny",Marisa Tomei,My Cousin Vinny,1964-12-04
120,nm0000136,2016-12-11,2016-12-11,"Sweeney Todd: The Demon Barber of Fleet Street, Finding Neverland, The Pirates of the Caribbean: The Curse of the Black Pearl",Johnny Depp,Sweeney Todd: The Demon Barber of Fleet Street,1963-06-09
121,nm0001557,2016-12-11,2019-01-22,"Green Book, Captain Fantastic, Eastern Promises",Viggo Mortensen,The Lord of the Rings: The Return of the King,1958-10-20
122,nm0001046,2016-12-11,2016-12-11,"Away From Her, Afterglow, McCabe and Mrs. Miller, Darling",Julie Christie,Doctor Zhivago,1940-04-14
123,nm0001473,2016-12-11,2016-12-11,"The Savages, Kinsey, You Can Count on Me",Laura Linney,The Big C,1964-02-05
124,nm0680983,2016-12-11,2016-12-11,Juno,Elliot Page,Juno,1987-02-21
125,nm0000729,2016-12-11,2017-01-24,"Manchester by the Sea, The Assassination of Jesse James by the Coward Robert Ford",Casey Affleck,Gone Baby Gone,1975-08-12
126,nm0001358,2016-12-11,2016-12-11,Into the Wild,Hal Holbrook,Into the Wild,1925-02-17
127,nm0929489,2016-12-11,2016-12-11,"Michael Clayton, In the Bedroom",Tom Wilkinson,Michael Clayton,1948-02-05
128,nm0842770,2016-12-11,2016-12-11,Michael Clayton,Tilda Swinton,We Need to Talk About Kevin,1960-11-05
129,nm0002039,2016-12-11,2016-12-11,American Gangster,Ruby Dee,American Gangster,1922-10-27
130,nm0752407,2016-12-11,2016-12-11,Gone Baby Gone,Amy Ryan,Gone Baby Gone,1968-05-03
131,nm0001845,2016-12-11,2016-12-11,The Last King of Scotland,Forest Whitaker,The Last King of Scotland,1961-07-15
132,nm0331516,2016-12-11,2016-12-11,Half Nelson,Ryan Gosling,La La Land,1980-11-12
133,nm0000564,2016-12-11,2016-12-11,"Venus, My Favorite Year, The Stunt Man, The Ruling Class, Goodbye Mr. Chips, The Lion in Winter, Beckett, Lawrence of Arabia",Peter O'Toole,Lawrence of Arabia,1932-08-02
134,nm0000226,2016-12-11,2022-02-10,"King Richard, The Pursuit of Happyness, Ali",Will Smith,The Fresh Prince of Bel-Air,1968-09-25
135,nm0355097,2016-12-11,2016-12-11,Little Children,Jackie Earle Haley,Watchmen,1961-07-14
136,nm0005023,2016-12-11,2016-12-11,"Blood Diamond, In America",Djimon Hounsou,Blood Diamond,1964-04-24
137,nm0000552,2016-12-11,2016-12-11,Dreamgirls,Eddie Murphy,The Nutty Professor,1961-04-03
138,nm0000242,2016-12-11,2016-12-11,The Departed,Mark Wahlberg,The Fighter,1971-06-05
139,nm1617685,2016-12-11,2016-12-11,Dreamgirls,Jennifer Hudson,Dreamgirls,1981-09-12
140,nm0056770,2016-12-11,2016-12-11,Babel,Adriana Barraza,Babel,1956-03-05
141,nm1113550,2016-12-11,2016-12-11,Little Miss Sunshine,Abigail Breslin,Little Miss Sunshine,1996-04-14
142,nm0452860,2016-12-11,2016-12-11,Babel,Rinko Kikuchi,Babel,1981-01-06
143,nm0005024,2016-12-11,2016-12-11,Hustle & Flow,Terrence Howard,Crash,1969-03-11
144,nm0000657,2016-12-11,2016-12-11,Good Night and Good Luck,David Strathairn,"Good Night, and Good Luck.",1949-01-26
145,nm0005031,2016-12-11,2016-12-11,Transamerica,Felicity Huffman,Transamerica,1962-12-09
146,nm0000234,2016-12-11,2020-01-13,"Bombshell, North Country, Monster",Charlize Theron,Monster,1975-08-07
147,nm0001838,2016-12-11,2019-01-22,"The Favourite, The Constant Gardner",Rachel Weisz,The Constant Gardener,1970-03-07
148,nm0001416,2016-12-11,2016-12-11,"Capote, Being John Malkovich",Catherine Keener,Being John Malkovich,1959-03-23
149,nm0000531,2016-12-11,2021-03-17,"Nomadland, Three Billboards Outside Ebbing Missouri, North Country, Almost Famous, Fargo, Mississippi Burning",Frances McDormand,"Three Billboards Outside Ebbing, Missouri",1957-06-23
150,nm0004937,2016-12-11,2016-12-11,"Ray, Collateral",Jamie Foxx,Ray,1967-12-13
151,nm0000332,2016-12-11,2016-12-11,Hotel Rwanda,Don Cheadle,Crash,1964-11-29
152,nm0000142,2016-12-11,2016-12-11,"Million Dollar Baby, Unforgiven",Clint Eastwood,Million Dollar Baby,1930-05-31
153,nm0005476,2016-12-11,2016-12-11,"Million Dollar Baby, Boys Don't Cry",Hilary Swank,Million Dollar Baby,1974-07-30
154,nm1503432,2016-12-11,2016-12-11,Maria Full of Grace,Catalina Sandino Moreno,Maria Full of Grace,1981-04-19
155,nm0001767,2016-12-11,2016-12-11,Vera Drake,Imelda Staunton,Vera Drake,1956-01-09
156,nm0000257,2016-12-11,2016-12-11,The Aviator,Alan Alda,M*A*S*H,1936-01-28
157,nm0002006,2016-12-11,2016-12-11,Sideways,Thomas Haden Church,Sideways,1960-06-17
158,nm0654110,2016-12-11,2016-12-11,Closer,Clive Owen,Children of Men,1964-10-03
159,nm0000515,2016-12-11,2016-12-11,Sideways,Virginia Madsen,Sideways,1961-09-11
160,nm0645683,2016-12-11,2016-12-11,Hotel Rwanda,Sophie Okonedo,Hotel Rwanda,1968-08-11
161,nm0001426,2016-12-11,2016-12-11,"House of Sand and Fog, Gandhi, Bugsy, Sexy Beast",Ben Kingsley,Sexy Beast,1943-12-31
162,nm0000179,2016-12-11,2016-12-11,"Cold Mountain, The Talented Mr. Ripley",Jude Law,The Talented Mr. Ripley,1972-12-29
163,nm0000195,2016-12-11,2016-12-11,Lost in Translation,Bill Murray,Lost in Translation,1950-09-21
164,nm1095720,2016-12-11,2016-12-11,Whale Rider,Keisha Castle-Hughes,Whale Rider,1990-03-24
165,nm0000473,2016-12-11,2016-12-11,"Something's Gotta Give, Marvin's Room, Reds, Annie Hall",Diane Keaton,Annie Hall,1946-01-05
166,nm0608090,2016-12-11,2016-12-11,"In America, Sweet and Lowdown",Samantha Morton,Minority Report,1977-05-13
167,nm0000209,2016-12-11,2016-12-11,Mystic River,Tim Robbins,Mystic River,1958-10-16
168,nm0000285,2016-12-11,2016-12-11,The Cooler,Alec Baldwin,The Departed,1958-04-03
169,nm0001125,2016-12-11,2016-12-11,"21 Grams, Traffic",Benicio Del Toro,Sicario,1967-02-19
170,nm0913822,2016-12-11,2016-12-11,The Last Samurai,Ken Watanabe,The Last Samurai,1959-10-21
171,nm0000250,2016-12-11,2020-01-13,"Judy, Cold Mountain, Chicago, Bridget Jones's Diary",Renée Zellweger,Chicago,1969-04-25
172,nm0013037,2016-12-11,2016-12-11,House of Sand and Fog,Shohreh Aghdashloo,House of Sand and Fog,1952-05-11
173,nm0165101,2016-12-11,2016-12-11,Pieces of April,Patricia Clarkson,The Station Agent,1959-12-29
174,nm0001315,2016-12-11,2016-12-11,"Mystic River, Pollock",Marcia Gay Harden,Mystic River,1959-08-14
175,nm0000456,2016-12-11,2016-12-11,"Thirteen, The Firm, The Piano, Broadcast News",Holly Hunter,Broadcast News,1958-03-20
176,nm0004778,2016-12-11,2016-12-11,The Piano,Adrien Brody,The Pianist,1973-04-14
177,nm0000115,2016-12-11,2016-12-11,"Adaptation, Leaving Las Vegas",Nicolas Cage,Face/Off,1964-01-07
178,nm0000323,2016-12-11,2016-12-11,"The Quiet American, The Cider House Rules, Hannah and Her Sisters, Educating Rita, Sleuth, Alfie",Michael Caine,The Dark Knight,1933-03-14
179,nm0000197,2016-12-11,2016-12-11,"About Schmidt, As Good As it Gets, A Few Good Men, Ironweed, Prizzi's Honor, Terms of Endearment, Reds, One Flew Over the Cuckoo's Nest, Chinatown, The Last Detail, Five Easy Pieces, Easy Rider",Jack Nicholson,Chinatown,1937-04-22
180,nm0000161,2016-12-11,2016-12-11,Frida,Salma Hayek,Frida,1966-09-02
181,nm0000178,2016-12-11,2016-12-11,Unfaithful,Diane Lane,Unfaithful,1965-01-22
182,nm0177933,2016-12-11,2016-12-11,Adaptation,Chris Cooper,Adaptation.,1951-07-09
183,nm0000438,2016-12-11,2016-12-11,"The Hours, Pollock, The Truman Show, Apollo 13",Ed Harris,The Truman Show,1950-11-28
184,nm0000056,2016-12-11,2016-12-11,"Road to Perdition, Nobody's Fool, The Color of Money, The Verdict, Absence of Malice, Cool Hand Luke, Hud, The Hustler, Cat on a Hot Tin Roof",Paul Newman,The Hustler,1925-01-26
185,nm0000604,2016-12-11,2016-12-11,Chicago,John C. Reilly,Chicago,1965-05-24
186,nm0000686,2016-12-11,2016-12-11,"Catch Me if You Can, The Deer Hunter",Christopher Walken,The Deer Hunter,1943-03-31
187,nm0001876,2016-12-11,2016-12-11,Chicago,Catherine Zeta-Jones,Chicago,1969-09-25
188,nm0000870,2016-12-11,2020-01-13,"Richard Jewell, About Schmidt, Primary Colors, Misery",Kathy Bates,Misery,1948-06-28
189,nm0001451,2016-12-11,2016-12-11,Chicago,Queen Latifah,Chicago,1970-03-18
190,nm0000128,2016-12-11,2016-12-11,"The Insider, A Beautiful Mind, Gladiator",Russell Crowe,Les Misérables,1964-04-07
191,nm0000932,2016-12-11,2016-12-11,Monster's Ball,Halle Berry,Catwoman,1966-08-14
192,nm0000651,2016-12-11,2016-12-11,"In the Bedroom, Crimes of the Heart, The River, Coal Miner's Daughter, Missing, Carrie",Sissy Spacek,In the Bedroom,1949-12-25
193,nm0000980,2016-12-11,2016-12-11,Iris,Jim Broadbent,Moulin Rouge!,1949-05-24
194,nm0005212,2016-12-11,2016-12-11,"The Lord of the Rings: The Fellowship of the Ring, Gods and Monsters",Ian McKellen,The Lord of the Rings: The Fellowship of the Ring,1939-05-25
195,nm0000685,2016-12-11,2016-12-11,"Ali, Runaway Train, Coming Home, Midnight Cowboy",Jon Voight,Midnight Cowboy,1938-12-29
196,nm0000124,2016-12-11,2016-12-11,A Beautiful Mind,Jennifer Connelly,A Beautiful Mind,1970-12-12
197,nm0001749,2016-12-11,2016-12-11,"Gosford Park, A Room with a View, California Suite, Travels with My Aunt, The Prime of Miss Jean Brodie, Othello",Maggie Smith,Gosford Park,1934-12-28
198,nm0000158,2016-12-11,2020-01-13,"A Beautiful Day in the Neighborhood, Cast Away, Saving Private Ryan, Forrest Gump, Philadelphia, Big",Tom Hanks,Cast Away,1956-07-09
199,nm0000260,2016-12-11,2016-12-11,"The Contender, The Crucible, Nixon",Joan Allen,Room,1956-08-20
200,nm0000300,2016-12-11,2016-12-11,"Chocolat, The English Patient",Juliette Binoche,The English Patient,1964-03-09
201,nm0000995,2016-12-11,2016-12-11,"Requiem for a Dream, Resurrection, Same Time Next Year, Alice Doesn't Live Here Anymore, The Exorcist, The Last Picture Show",Ellen Burstyn,Requiem for a Dream,1932-12-07
202,nm0000353,2016-12-11,2019-01-22,"At Eternity's Gate, The Florida Project, Shadow of the Vampire, Platoon",Willem Dafoe,At Eternity's Gate,1955-07-22
203,nm0001215,2016-12-11,2016-12-11,"Erin Brockovich, Under the Volcano, The Dresser, Murder on the Orient Express, Tom Jones",Albert Finney,Erin Brockovich,1936-05-09
204,nm0005028,2016-12-11,2016-12-11,Almost Famous,Kate Hudson,Almost Famous,1979-04-19
205,nm0910278,2016-12-11,2016-12-11,"Billy Elliot, Educating Rita",Julie Walters,Billy Elliot,1950-02-22
206,nm0000228,2016-12-11,2016-12-11,"American Beauty, The Usual Suspects",Kevin Spacey,The Usual Suspects,1959-07-26
207,nm0002070,2016-12-11,2016-12-12,"The Straight Story, Comes a Horseman",Richard Farnsworth,The Straight Story,1920-09-01
208,nm0000129,2016-12-11,2016-12-11,"Magnolia, Jerry Maguire, Born on the Fourth of July",Tom Cruise,Top Gun,1962-07-03
209,nm0003817,2016-12-11,2016-12-11,The Green Mile,Michael Clarke Duncan,The Green Mile,1957-12-10
210,nm0005286,2016-12-11,2016-12-11,The Sixth Sense,Haley Joel Osment,The Sixth Sense,1988-04-10
211,nm0001057,2016-12-11,2016-12-11,The Sixth Sense,Toni Collette,The Sixth Sense,1972-11-01
212,nm0001721,2016-12-11,2016-12-11,Boys Don't Cry,Chloë Sevigny,We Are Who We Are,1974-11-18
213,nm0000905,2016-12-11,2016-12-11,Life is Beautiful,Roberto Benigni,La vita è bella,1952-10-27
214,nm0000569,2016-12-11,2016-12-11,Shakespeare in Love,Gwyneth Paltrow,Shakespeare in Love,1972-09-27
215,nm0005244,2016-12-11,2016-12-11,Central Station,Fernanda Montenegro,Central do Brasil,1929-10-16
216,nm0001833,2016-12-11,2016-12-11,"Hilary and Jackie, Breaking the Waves",Emily Watson,Gosford Park,1967-01-14
217,nm0000336,2016-12-11,2016-12-11,Affliction,James Coburn,Charade,1928-08-31
218,nm0000671,2016-12-11,2016-12-11,"A Simple Plan, Sling Blade",Billy Bob Thornton,Sling Blade,1955-08-04
219,nm0000950,2016-12-11,2016-12-11,"Little Voice, Secrets and Lies",Brenda Blethyn,Pride & Prejudice,1946-02-20
220,nm0341737,2016-12-11,2016-12-11,Hilary and Jackie,Rachel Griffiths,Six Feet Under,1968-12-18
